1|JB|Bla bla bla bla bla
2|Wilfried|Gossip gossip gossip !
3|David|Yassine is in fact YARO 31 !
4|Yassine|David is not who he pretends... He is THE LIBRARIAN !
7|Machiavel|When dealing with ennemies, using words instead of swords to kill avoid any return to life and grace
8|Valy|Psychologists can kill you faster than they will ever heal you ^_^
9|Jean-Baptiste|J'ai entendu dire que qq1 codait une nouvelle version de Gossip avec des IDs et la possibilité de supprimer des gossips... Mais chuuut !
10|Actarus|Je sais pourquoi il me faut 2 tours de sièges pour arriver dans Golodorak : c'est parce que... Arrrghhh!
11|Lucie|Hortense a été une vraie peau de vache aujourd'hui mais Monsieur HERITIER l'a punie... Na! Na! Nèreeee!
